{
  "record_type": "evidence_pack_manifest",
  "run_id": "run-2026-06",
  "created_at": "2026-07-01T12:00:00Z",
  "model_id": "mdl-smb-credit-xgb",
  "version_id": "ver-2026-06",
  "input_references": [
    "model-registry-record.json",
    "model-version-record.json",
    "threshold-set.json",
    "fair-lending-screening-config.json",
    "application-decision-records.json",
    "adverse-action-reason-outputs.json"
  ],
  "output_files": [
    "metric_results.json",
    "breach_register.json",
    "reason_qa_results.json",
    "reason_stability_report.json",
    "fair_lending_screening_results.json",
    "fair_lending_escalation_register.json",
    "lda_assessment_results.json",
    "reviewer_notes.md",
    "monitoring_report.md"
  ],
  "reviewer_status": "pending_review"
}
